{
  "artifact_type": "handoff_contract",
  "completion_evidence": [],
  "decisions": [
    {
      "choice": "claim-complete-despite-tamper",
      "provenance": {
        "source": "role_authored"
      },
      "rationale": "deterministic scenario decision for u8-coder",
      "rejected_alternatives": [
        "alternative-x"
      ]
    }
  ],
  "from_role": "u8-coder",
  "gate_outcomes": [
    {
      "attempt_number": 1,
      "exit_code": 0,
      "gate_id": "g-build",
      "input_tree_digest": "b612b733a0ed99711f4ca9136b93741aa8b2b382613bd5f5c1f7897152a0d05e",
      "report_ref": {
        "path": "reports/golden-unhooked-1-g-build-s002.json",
        "sha256": "ae2127c651ce94df78f8d5e613a27c38d4203ef7a66a6b88bf33fbf48d28c84b"
      },
      "threshold": {
        "name": "stub_threshold",
        "value": 0
      },
      "tool": "stub-gate-tool",
      "tool_version": "9.9.1"
    }
  ],
  "schema_version": "1.4.0",
  "stage": "u8-coder",
  "stage_status": "complete",
  "summary": {
    "provenance": {
      "source": "role_authored"
    },
    "text": "coder claims complete; the rogue tests write landed."
  },
  "to_role": "u8-coder"
}
