{
  "artifact_type": "handoff_contract",
  "completion_evidence": [],
  "decisions": [
    {
      "choice": "accept-coverage-envelope",
      "provenance": {
        "source": "role_authored"
      },
      "rationale": "deterministic scenario decision 2",
      "rejected_alternatives": [
        "alternative-2"
      ]
    }
  ],
  "from_role": "g-checker",
  "gate_outcomes": [
    {
      "attempt_number": 1,
      "exit_code": 0,
      "gate_id": "g-tests",
      "input_tree_digest": "10f17d31b10fded09759a4c85dd7beb702b4586bc68e73cdb769e9a57b3824d0",
      "report_ref": {
        "path": "reports/golden-green-1-g-tests-s006.json",
        "sha256": "655c0f617d25aa29670f5bab205eb030a25920f163d468192ac51773e81f234d"
      },
      "threshold": {
        "name": "stub_threshold",
        "value": 0
      },
      "tool": "stub-gate-tool",
      "tool_version": "9.9.1"
    }
  ],
  "schema_version": "1.4.0",
  "stage": "g-checker",
  "stage_status": "complete",
  "summary": {
    "provenance": {
      "source": "role_authored"
    },
    "text": "checker stage complete, tests green."
  },
  "to_role": "g-coder"
}
